{
  "schema": "lifecycle.fixture-manifest.v1",
  "specificationId": "lifecycle",
  "specificationRevision": "lifecycle.foundation.1.0.0-rc.10",
  "fixtures": [
    {
      "id": "agent-attempt-payload-structural-valid",
      "path": "agent-attempt-payload-structural-valid",
      "profile": "agent-attempt-payload-structural-fixture-v3",
      "complete": true,
      "valid": true,
      "diagnostics": [],
      "allowedDiagnostics": [],
      "subjectDigest": "sha256:d265197146f2914511e9fdb688e2edafdef5d327546303bed9b30011207cd4be",
      "description": "One funded Agent Attempt binds exactly one fresh Founder Brief and one bounded provider invocation."
    },
    {
      "id": "agent-work-product-payload-structural-valid",
      "path": "agent-work-product-payload-structural-valid",
      "profile": "agent-work-product-payload-structural-fixture-v2",
      "complete": true,
      "valid": true,
      "diagnostics": [],
      "allowedDiagnostics": [],
      "subjectDigest": "sha256:cb638ac8f5f527f071daa151d461014b7a8a4591daf269f025ca8a566db4dc83",
      "description": "One Agent Work Product retains body-only semantic Markdown without protocol mechanics."
    },
    {
      "id": "atlas-resolution-partial-model-invalid",
      "path": "atlas-resolution-partial-model-invalid",
      "profile": "atlas-resolution-structural-fixture-v2",
      "complete": true,
      "valid": false,
      "diagnostics": [
        "lifecycle.schema.invalid"
      ],
      "allowedDiagnostics": [],
      "subjectDigest": "sha256:54069e3df9855da1b955153971d33fe91af8d44edffc01729206f41d7bf56d42",
      "description": "An incomplete invalid Atlas processing outcome cannot carry a partial normalized-model digest."
    },
    {
      "id": "atlas-resolution-processor-selection-invalid",
      "path": "atlas-resolution-processor-selection-invalid",
      "profile": "atlas-resolution-structural-fixture-v2",
      "complete": true,
      "valid": false,
      "diagnostics": [
        "lifecycle.schema.invalid"
      ],
      "allowedDiagnostics": [],
      "subjectDigest": "sha256:bf03c0033e1f585bc87ef620e9367152ff5ea9e63131ac0469a522d74de0c938",
      "description": "An Atlas Resolution cannot substitute another processor version while retaining Foundation's selected Atlas coordinates."
    },
    {
      "id": "atlas-resolution-resource-binding-duplicate-invalid",
      "path": "atlas-resolution-resource-binding-duplicate-invalid",
      "profile": "atlas-resolution-structural-fixture-v2",
      "complete": true,
      "valid": false,
      "diagnostics": [
        "lifecycle.schema.invalid"
      ],
      "allowedDiagnostics": [],
      "subjectDigest": "sha256:0c2cd1d85979021930723af2e2b0263a0956a0188827ceadb0fa49b2801c24ac",
      "description": "An Atlas Resolution cannot repeat the same complete Resource binding; Resource-id uniqueness across otherwise distinct bindings remains a semantic requirement."
    },
    {
      "id": "atlas-resolution-resource-disposition-invalid",
      "path": "atlas-resolution-resource-disposition-invalid",
      "profile": "atlas-resolution-structural-fixture-v2",
      "complete": true,
      "valid": false,
      "diagnostics": [
        "lifecycle.schema.invalid"
      ],
      "allowedDiagnostics": [],
      "subjectDigest": "sha256:98187eb6ca35eb3c6e82d166da4f072a43fc2dade5efdca522866c9622ebf641",
      "description": "A missing Atlas Resource binding cannot retain mode, object-identity, or byte-digest facts as if it had resolved."
    },
    {
      "id": "atlas-resolution-structural-valid",
      "path": "atlas-resolution-structural-valid",
      "profile": "atlas-resolution-structural-fixture-v2",
      "complete": true,
      "valid": true,
      "diagnostics": [],
      "allowedDiagnostics": [],
      "subjectDigest": "sha256:fc213faf757b43b9e8ec8a0a86748098f71c64f768b1ee10ebbfd55beeb4973a",
      "description": "One complete valid Atlas Resolution binds the exact supported selection, raw State, processor, Resource inputs, external result, and normalized model."
    },
    {
      "id": "atlas-resolution-unsupported-selection-invalid",
      "path": "atlas-resolution-unsupported-selection-invalid",
      "profile": "atlas-resolution-structural-fixture-v2",
      "complete": true,
      "valid": false,
      "diagnostics": [
        "lifecycle.schema.invalid"
      ],
      "allowedDiagnostics": [],
      "subjectDigest": "sha256:26f4564c13ec902e28eb08be461e7abe8b1af1892fcfce110704334f6cd604d6",
      "description": "An unsupported Atlas release is refused even when the authored format integer matches Foundation's selected format."
    },
    {
      "id": "candidate-revision-payload-structural-valid",
      "path": "candidate-revision-payload-structural-valid",
      "profile": "candidate-revision-payload-structural-fixture-v2",
      "complete": true,
      "valid": true,
      "diagnostics": [],
      "allowedDiagnostics": [],
      "subjectDigest": "sha256:f24a1c104b47babf64d467dd5bea0fc65c3cda9a9698ad2032f7c9edb948cdb7",
      "description": "A Candidate Revision records one exact runtime-observed reversible product state."
    },
    {
      "id": "candidate-revision-carrier-manifest-structural-valid",
      "path": "candidate-revision-carrier-manifest-structural-valid",
      "profile": "candidate-revision-carrier-manifest-structural-fixture-v1",
      "complete": true,
      "valid": true,
      "diagnostics": [],
      "allowedDiagnostics": [],
      "subjectDigest": "sha256:8dd3681dcde34c826ad019bd8ef80d4958e6c7679dd2105e3feef3a75ccd8457",
      "description": "A Candidate Revision Carrier manifest binds one exact Git object closure, uncompressed object-byte inventory, and immutable pack artifact."
    },
    {
      "id": "candidate-revision-carrier-media-type-invalid",
      "path": "candidate-revision-carrier-media-type-invalid",
      "profile": "candidate-revision-payload-structural-fixture-v2",
      "complete": true,
      "valid": false,
      "diagnostics": [
        "lifecycle.schema.invalid"
      ],
      "allowedDiagnostics": [],
      "subjectDigest": "sha256:377dd3b58490906ccbd3ad1575beb3b50a06da0da46d04240296585dad873e8a",
      "description": "A Candidate Revision refuses a Carrier manifest reference with a generic rather than exact Lifecycle media type."
    },
    {
      "id": "candidate-revision-carrier-mode-invalid",
      "path": "candidate-revision-carrier-mode-invalid",
      "profile": "candidate-revision-carrier-manifest-structural-fixture-v1",
      "complete": true,
      "valid": false,
      "diagnostics": [
        "lifecycle.schema.invalid"
      ],
      "allowedDiagnostics": [],
      "subjectDigest": "sha256:09843684391ce5d384039bea83e9f317a3b1318edd0a08ca426c498f25844455",
      "description": "A Candidate Revision Carrier refuses a symlink tree mode outside the closed regular-file, executable-file, and tree mode set."
    },
    {
      "id": "candidate-revision-carrier-object-invalid",
      "path": "candidate-revision-carrier-object-invalid",
      "profile": "candidate-revision-carrier-manifest-structural-fixture-v1",
      "complete": true,
      "valid": false,
      "diagnostics": [
        "lifecycle.schema.invalid"
      ],
      "allowedDiagnostics": [],
      "subjectDigest": "sha256:066c26a9d02265fa498ba10bed416daeb2007f13496e748818077bf6aba57fcc",
      "description": "A Candidate Revision Carrier refuses an object inventory entry without an exact Git object identity."
    },
    {
      "id": "candidate-seal-payload-structural-valid",
      "path": "candidate-seal-payload-structural-valid",
      "profile": "candidate-seal-payload-structural-fixture-v2",
      "complete": true,
      "valid": true,
      "diagnostics": [],
      "allowedDiagnostics": [],
      "subjectDigest": "sha256:aaf315dfb87cefaa2326a61cb87dc21742c0beb56a417bba6571d6bed0ad2256",
      "description": "A Candidate Seal payload records runtime-authenticated evaluation-subject facts."
    },
    {
      "id": "capability-profile-structural-valid",
      "path": "capability-profile-structural-valid",
      "profile": "capability-profile-structural-fixture-v2",
      "complete": true,
      "valid": true,
      "diagnostics": [],
      "allowedDiagnostics": [],
      "subjectDigest": "sha256:b1c938c274b338143c6d46d958c425c0445a8ba911d150300a32a1c07538c2ef",
      "description": "A Capability Profile grants bounded Candidate, temporary-write, subprocess, network, credential, and external-effect authority without backend mechanics."
    },
    {
      "id": "check-receipt-payload-structural-valid",
      "path": "check-receipt-payload-structural-valid",
      "profile": "check-receipt-payload-structural-fixture-v2",
      "complete": true,
      "valid": true,
      "diagnostics": [],
      "allowedDiagnostics": [],
      "subjectDigest": "sha256:a4bdc22c6a4a28c5377b2b04f07cd2343cce512be68e9d7dad5c3afae6652589",
      "description": "A passed baseline precondition Check Receipt binds its allocated Execution Cell, retrieved output, Containment, and Retirement facts to one exact Check subject."
    },
    {
      "id": "closure-payload-structural-valid",
      "path": "closure-payload-structural-valid",
      "profile": "closure-payload-structural-fixture-v4",
      "complete": true,
      "valid": true,
      "diagnostics": [],
      "allowedDiagnostics": [],
      "subjectDigest": "sha256:44ed4197c1ef84e96fbe627ad33fdd984ccd8433f684c8b83211c1560a8bac93",
      "description": "A no-ship Closure payload proves non-integration, terminal Execution containment and retirement, and a truthful reclamation handoff."
    },
    {
      "id": "control-lifecycle-profile-structural-valid",
      "path": "control-lifecycle-profile-structural-valid",
      "profile": "control-lifecycle-profile-structural-fixture-v4",
      "complete": true,
      "valid": true,
      "diagnostics": [],
      "allowedDiagnostics": [],